{
  "$schema": "https://raw.githubusercontent.com/dkharlanau/agent-ready-web-profile/main/registry/directory.schema.json",
  "version": "0.1",
  "updatedAt": "2026-08-25",
  "description": "Initial public directory of sites that publish Agent-Ready Web Profiles. Inclusion records declared capabilities; it is not a quality ranking or endorsement.",
  "sites": [
    {"id":"dkharlanau-sap-knowledge","name":"Dzmitryi Kharlanau — SAP Knowledge","category":"Enterprise / SAP","canonicalUrl":"https://dkharlanau.github.io/","profileUrl":"https://dkharlanau.github.io/ai/site-profile.json","summary":"Professional SAP operations and transformation knowledge with structured datasets, retrieval indexes, Agent Skills discovery and local read-only MCP implementations.","capabilities":{"web":true,"data":true,"retrieval":true,"openapi":false,"agentSkills":true,"webmcp":false,"mcp":"local","a2a":false,"trust":true}},
    {"id":"brali-practical-knowledge","name":"Brali Practical Knowledge Library","category":"Practical knowledge","canonicalUrl":"https://brali-lifeos.github.io/","profileUrl":"https://brali-lifeos.github.io/ai/site-profile.json","summary":"Evidence-aware practical knowledge with a static API, search distribution, stable identities, provenance and a local read-only MCP server.","capabilities":{"web":true,"data":true,"retrieval":true,"openapi":true,"agentSkills":false,"webmcp":false,"mcp":"local","a2a":false,"trust":true}},
    {"id":"cognitive-biases-knowledge","name":"Cognitive Biases Knowledge Library","category":"Decision science","canonicalUrl":"https://cognitive-biases.github.io/","profileUrl":"https://cognitive-biases.github.io/ai/site-profile.json","summary":"Public evidence and decision-making library with versioned data, retrieval-ready NDJSON, provenance and a local reference MCP adapter.","capabilities":{"web":true,"data":true,"retrieval":true,"openapi":false,"agentSkills":false,"webmcp":false,"mcp":"local","a2a":false,"trust":true}},
    {"id":"cbt-cards-public-reflection","name":"CBT Cards Public Reflection Resource","category":"Education / reflection","canonicalUrl":"https://cbt-cards.github.io/","profileUrl":"https://cbt-cards.github.io/ai/site-profile.json","summary":"Inspectable reflection resources with reviewed practice retrieval, explicit safety boundaries, provenance and a portable Agent Skill.","capabilities":{"web":true,"data":true,"retrieval":true,"openapi":false,"agentSkills":true,"webmcp":false,"mcp":false,"a2a":false,"trust":true}},
    {"id":"metkagram-language-knowledge","name":"Metkagram","category":"Language / NLP","canonicalUrl":"https://metkagram.github.io/","profileUrl":"https://metkagram.github.io/ai/site-profile.json","summary":"Multilingual language-learning and NLP knowledge with canonical data, schemas, OpenAPI, provenance and a generated retrieval index.","capabilities":{"web":true,"data":true,"retrieval":true,"openapi":true,"agentSkills":false,"webmcp":false,"mcp":false,"a2a":false,"trust":true}}
  ]
}
